{
  "objectType": "SCHEDULE_SPEC",
  "objectId": "chief-of-staff-wiki-recall-check-current-state",
  "title": "总助 wiki 全量 recall checkpoint",
  "status": "approved",
  "priority": "high",
  "ownerRole": "CEOChiefOfStaff",
  "createdAt": "2026-04-21T01:40:00+08:00",
  "updatedAt": "2026-04-21T01:40:00+08:00",
  "timebox": {
    "scope": "weekly",
    "label": "phase-1 schedule staging"
  },
  "summary": "检查总助 wiki 页面是否已经进入全量 recall，并把结果写入审计层。",
  "relatedModules": [
    "TriCompany",
    "TriMetaverse"
  ],
  "evidence": [
    {
      "source": "runtime/cognition/chief_of_staff_wiki_recall_validation.py",
      "kind": "document",
      "note": "stable-only 与 all-pages wiki recall 双模式验证"
    }
  ],
  "nextActions": [
    {
      "owner": "CEOChiefOfStaff",
      "action": "执行 chief-of-staff all-pages recall checkpoint staging"
    }
  ],
  "workflowRefs": [
    {
      "phase": "DESIGNING",
      "artifact": "chief-of-staff-llm-wiki"
    }
  ],
  "payload": {
    "targetType": "checkpoint",
    "targetRef": "chief-of-staff-wiki-recall-check-current-state",
    "targetVersion": "v0.1",
    "scheduleType": "cron",
    "scheduleExpression": "* * * * *",
    "executionHost": "copilot-chat",
    "approvalGate": "manual-only",
    "failurePolicy": "freeze",
    "auditRequired": true,
    "enabled": true,
    "concurrencyPolicy": "forbid-overlap",
    "stopConditions": [
      "manual-stop"
    ],
    "deliveryChannel": "file",
    "deliveryTarget": "knowledge/chief-of-staff/audit",
    "note": "phase-2 chief-of-staff all-pages recall checkpoint staging",
    "taskConfig": {
      "checkpointKind": "wiki-recall",
      "pageId": "chief-of-staff-llm-wiki-semi-auto-current-state",
      "recallMode": "all-pages"
    }
  },
  "metadata": {
    "staging": true,
    "notProduction": true
  }
}